순번,출원일,출원번호,등록일,등록번호,주발명자,공동발명자,출원의 명칭(한),분야별 기술(6T),데이터기준일
353,2021-12-20,10-2021-0183064,2024-11-13,10-2731667,제민규,"제민규,최재석,김철",초음파 펄서 및 커패시터브 부하 구동 장치 ,정보기술(IT),2024-12-31
354,2022-06-03,10-2022-0068365,2024-04-30,10-2663391,김천곤,"김천곤,장우혁,장민수,진도현,김민성",전자파 흡수 구조체 및 그것의 제조 방법,우주항공기술(ST),2024-12-31
355,2022-08-09,10-2022-0099198,2024-12-18,10-2745542,명현,"명현,유병호,이현규",벽면 부착을 위한 준-탈동조화 제어기 기반의 공중 변형 드론 및 그 제어 방법,정보기술(IT),2024-12-31
356,2021-12-23,10-2021-0186139,2024-02-26,10-2642058,김문철,"김문철,기세환","시간 적응적, 공간 선택적 시그널링을 이용한 뉴럴 네트워크 처리 방법 및 장치",정보기술(IT),2024-12-31
357,2022-05-02,10-2022-0054350,2024-12-18,10-2745541,명현,"명현,이현규,정명우,김찬영,임형태",벽면 부착을 위한 틸팅 드론의 강화학습 기반 낮은 수준의 자세 제어 방법 및 장치,정보기술(IT),2024-12-31
358,2022-08-04,10-2022-0097492,2024-08-19,10-2697973,명현,"명현,현지음",UWB 및 관성 센서 기반의 로봇 위치 추정 장치 및 방법,정보기술(IT),2024-12-31
359,2022-04-15,10-2022-0046790,2024-11-07,10-2729263,홍화정,"홍화정,한경식,유희정,김보관",게임 기반 애플리케이션을 이용한 자폐 스펙트럼 장애인 루틴 관리 방법 및 단말장치,정보기술(IT),2024-12-31
360,2022-04-22,10-2022-0049978,2024-11-06,10-2728744,강병훈,"강병훈,김은진",개인 위치 정보의 민감 단계별 프라이버시 보호 및 효율적 원본 위치 복구 기법,정보기술(IT),2024-12-31
361,2021-12-28,10-2021-0189924,2024-03-22,10-2651909,제민규,"제민규,길준호,박철현,김근회,하소명,정윤태,오세인,권순재,최인준",임피던스 측정 장치 및 임피던스 측정 방법,정보기술(IT),2024-12-31
362,2021-12-30,10-2021-0193058,2024-06-24,10-2679025,박지호,"박지호,백우진,정직한",엑소좀 분리용 조성물 및 이를 이용한 엑소좀 분리 방법,생명공학기술(BT),2024-12-31
363,2022-01-27,10-2022-0011916,2024-11-21,10-2734233,박효훈,"박효훈,윤현호,김재용",양방향 연마된 실리카 광 도파로를 이용하는 광 모듈 패키지,나노기술(NT),2024-12-31
364,2022-03-29,10-2022-0038919,2024-12-24,10-2748166,전성윤,"전성윤,성형진,박진수,김승규,남현오,차범석",동적 세포 배양을 위한 음향미세유체 기반 상부 개방형 바이오리액터 및 그의 제조 방법,생명공학기술(BT),2024-12-31
365,2022-04-15,10-2022-0047124,2024-12-03,10-2739549,손수엘,"손수엘,이소영,위성일",강화 학습을 이용한 반사형 크로스 사이트 스크립팅 취약점 탐지 방법 및 시스템,정보기술(IT),2024-12-31
366,2022-02-14,10-2022-0018808,2024-11-27,10-2736776,이필승,이필승,레이어 구조를 이용한 플렉서블 디스플레이의 주름 완화 장치,정보기술(IT),2024-12-31
367,2022-04-15,10-2022-0046794,2024-11-07,10-2729012,가현욱,가현욱,길안내 단말장치 및 그 제어 방법,정보기술(IT),2024-12-31
368,2022-04-14,10-2022-0046231,2024-02-27,10-2642623,가현욱,가현욱,"시각장애 휠체어 사용자를 위한 구동 제어 신호 생성 장치, 이동 보조 수단 및 휠체어",정보기술(IT),2024-12-31
369,2022-03-28,10-2022-0037791,2024-07-24,10-2689251,박현철,"박현철,황민영",지능형 반사 표면을 이용한 무선 에너지 하베스팅 극대화를 위한 컴퓨터 시스템 및 그의 방법,정보기술(IT),2024-12-31
370,2022-04-29,10-2022-0053193,2024-01-19,10-2628692,신종화,"신종화,김나영,김명준",각도 다중화 메타렌즈,나노기술(NT),2024-12-31
371,2022-03-04,10-2022-0027899,2024-11-21,10-2734231,전성윤,"전성윤,김재상,박준하",오가노이드 배양 및 약물 스크리닝을 위한 미세유체 칩 및 그의 이용 방법,생명공학기술(BT),2024-12-31
372,2022-04-01,10-2022-0040989,2024-12-24,10-2748165,정재웅,"정재웅,강인호",자력 기반의 모듈화된 조립형 바이오 전자소자,생명공학기술(BT),2024-12-31
373,2022-03-21,10-2022-0034780,2024-10-04,10-2715760,정원일,"정원일,김희훈", 카테콜아민/ADRB2 매개 간질환 치료제 스크리닝 방법  ,생명공학기술(BT),2024-12-31
374,2022-01-27,10-2022-0012358,2024-11-07,10-2729318,조광현,"조광현,황채영,이종훈,최새롬",악성 유방암의 치료 또는 예방용 약학적 조성물,생명공학기술(BT),2024-12-31
375,2022-02-11,10-2022-0017924,2024-01-02,10-2621307,예종철,"예종철,김의연",블록체인 기술을 활용한 스마트 컨트랙트 기반 데이터와 연산 장치의 사용권한을 결합한 상품으로 NFT 토큰 발행 방법 및 장치,정보기술(IT),2024-12-31
376,2022-02-10,10-2022-0017431,2024-01-17,10-2627563,신종화,"신종화,장태용",고변조 메타물질 구조체,나노기술(NT),2024-12-31
377,2022-05-23,10-2022-0063019,2024-08-07,10-2694321,이진우,"이진우,김성빈","귀금속 원자의 동적배치를 이용한 귀금속 단원자, 클러스터-다공성 몰리브덴 탄화물/탄소 나노복합체, 이의 제조방법, 이를 포함하는 수소생성반응용 또는 수소산화반응용 촉매 및 상기 촉매를 포함하는 전극",나노기술(NT),2024-12-31
378,2022-04-04,10-2022-0041902,2024-12-31,10-2750342,김천곤,"김천곤,차지훈,장우혁,Sathish Kumar Sarath Kumar",지구 궤도 우주 물체의 지상 실험을 위한 시스템,우주항공기술(ST),2024-12-31
379,2022-11-24,10-2022-0159693,2024-11-01,10-2726839,유지환,"유지환,성현석,장재형,백승준,이진원,권순철",스트링 액추에이터 기반 가변 반지름 이중 풀리 메커니즘,나노기술(NT),2024-12-31
380,2022-05-12,10-2022-0058502,2024-12-16,10-2744862,김훈,"김훈,마이베트왕,박재돈",멀티캐스트 자유 공간 광통신을 위한 빔 조향 장치 및 이를 포함하는 송신기,정보기술(IT),2024-12-31
381,2022-05-12,10-2022-0058532,2024-10-22,10-2722224,정상권,"정상권,권도훈",단열 특성을 조절 가능한 액체 수소 저장 장치,환경/에너지기술(ET),2024-12-31
382,2022-03-25,10-2022-0037468,2024-10-23,10-2722529,정기훈,"정기훈,배상인,권재명",마이크로 렌즈 어레이를 포함하는 초소형 라이트 필드 카메라와 그 제작방법 및 초소형 라이트 필드 카메라를 이용하는 표정 인식 방법,정보기술(IT),2024-12-31
383,2022-03-08,10-2022-0029665,2024-11-04,10-2727629,김성수,"김성수,김원빈,온승윤,홍현수,임수현,김원기,조현성,신동규,김언,전규진,김광현",폐쇄형 열전 폼,환경/에너지기술(ET),2024-12-31
384,2022-04-25,10-2022-0050834,2024-07-30,10-2691559,길계태,"길계태,전유리,박현철",상향 링크에서 가시선 채널 특성을 활용한 통신 시스템 및 그의 동작 방법 ,정보기술(IT),2024-12-31
385,2022-04-22,10-2022-0050221,2024-11-11,10-2730330,안승영,"안승영,김제독,안장용","보조 코일을 이용한 무선 전력 송신 장치, 무선 전력 수신 장치 및 무선 전력 전송 시스템",정보기술(IT),2024-12-31
386,2022-03-14,10-2022-0031368,2024-11-14,10-2731829,양희준,양희준,저항성 메모리 소자 및 이를 이용한 컴퓨팅 방법 ,나노기술(NT),2024-12-31
387,2022-06-30,10-2022-0080200,2024-11-29,10-2737909,전석우,"전석우,현가담,문천우,김영지",동적 구조색 픽셀,나노기술(NT),2024-12-31
388,2022-04-27,10-2022-0052044,2024-12-17,10-2745395,윤찬현,"윤찬현,김성환,양은주,김지환,이정원",오픈 데이터 생태계에서의 다중 데이터 허브 간 데이터 실시간 동기화 시스템 및 방법,정보기술(IT),2024-12-31
389,2022-06-29,10-2022-0079922,2024-11-06,10-2728741,서명은,"서명은,박종민,박은숙,이해신",접착제 조성물 및 이의 제조 방법,나노기술(NT),2024-12-31
390,2022-07-12,10-2022-0085542,2024-09-27,10-2713249,김철,"김철,장준태,장용희,조재욱",전계효과 커패시턴스를 활용한 커패시티브 무선전력 전송 시스템,정보기술(IT),2024-12-31
391,2022-05-10,10-2022-0057250,2024-12-18,10-2745723,경기욱,"경기욱,김산하,황건우,DAVID SANTIAGO DIAZ CORTES,양인영",소프트 로봇 핸드,정보기술(IT),2024-12-31
392,2022-09-23,10-2022-0120595,2024-06-21,10-2678476,김용대,"김용대,배상욱,강민석,오범석,안준호,손민철,이용화",이동통신망 단말의 제어평면 메시지 기반 핑거프린트를 사용한 심박스 차단 방법 및 장치,정보기술(IT),2024-12-31
393,2022-04-21,10-2022-0049631,2024-12-24,10-2748091,정상권,"정상권,김진욱,권도훈,배준혁",액체 수소의 증발 손실을 방지할 수 있는 액체 수소 저장 장치 및 흡착 탱크,환경/에너지기술(ET),2024-12-31
394,2022-06-03,10-2022-0068029,2024-11-06,10-2728713,최준균,"최준균,한재섭,이경호",엣지 컴퓨팅 환경 내 딥러닝 기법을 활용한 오차예측 기반 데이터 전송주기제어 프레임워크 방법 및 시스템,정보기술(IT),2024-12-31
395,2022-06-23,10-2022-0076500,2024-11-21,10-2734232,하정석,"하정석,이진영",협력 다중 사용자 기반 은밀 통신 방법 및 시스템,정보기술(IT),2024-12-31
396,2022-05-24,10-2022-0063214,2024-07-23,10-2688880,김택수,"김택수,김지훈,표재범",반자기 부상을 이용한 소프트 로봇,나노기술(NT),2024-12-31
397,2022-07-29,10-2022-0094416,2024-08-16,10-2697410,유종원,"유종원,김솔,이효원,양대근",빔 포밍 장치 및 빔 포밍 방법,정보기술(IT),2024-12-31
398,2022-06-08,10-2022-0069394,2024-12-24,10-2748135,김산하,"김산하,김성재,정지훈",저점착성 나노다공성 박막 내 모세관력을 이용한 마이크로 조립 디바이스 및 이의 제작 방법,나노기술(NT),2024-12-31
399,2022-05-13,10-2022-0058765,2024-02-26,10-2642288,조성오,"조성오,허준",Method for improving corrosion resistance of weld zone of stainless steel and dry storge canister for spent fuel prepared by using the same,나노기술(NT),2024-12-31
400,2022-05-10,10-2022-0057254,2024-12-16,10-2744507,이필승,"이필승,현철규,배준한,조정희",가변 접착층을 이용한 플렉서블 디스플레이 장치,정보기술(IT),2024-12-31
401,2022-06-08,10-2022-0069537,2024-10-14,10-2718962,최양규,"최양규,정진우",무작위적 진동 특성을 이용하여 물리적 복제 방지 기능을 구비한 단일 트랜지스터 구조의 은폐 가능한 보안 키 소자,나노기술(NT),2024-12-31
402,2022-06-20,10-2022-0075146,2024-06-04,10-2673888,유회준,"유회준,Wenao Xie","반대 상태를 가지는 한 쌍의 자기 터널 접합을 구비한 MRAM 셀, 및 그를 이용한 메모리 장치",정보기술(IT),2024-12-31
403,2022-04-12,10-2022-0045261,2024-04-03,10-2655746,최학준,"최학준,윤우열,조동호",전기자동차의 주행 중 무선충전을 위한 분산 제어 방법 및 분산 통신 시스템,환경/에너지기술(ET),2024-12-31
404,2022-05-31,10-2022-0066569,2024-12-05,10-2740693,강병훈,"강병훈,김대경,김건우,최원우,김은진,임창일,이호준,송용호,이준수",소프트웨어 기반의 개별분리 아키텍처 시스템 시뮬레이터 및 그의 방법,정보기술(IT),2024-12-31
405,2022-07-12,10-2022-0085714,2024-01-09,10-2624772,윤세영,"윤세영,정송,이용식,오지환",최적의 초소 위치 선정을 위한 시뮬레이션 방법 및 이를 위한 시뮬레이션장치,정보기술(IT),2024-12-31
406,2022-11-11,10-2022-0150662,2024-12-02,10-2738891,이성주,"이성주,공태식,윤형준,이택경,안재하",시간 축에 따른 사전 이동성을 활용한 지리적 애드혹 라우팅 강화학습 방법 및 이를 위한 컴퓨터 장치,정보기술(IT),2024-12-31
407,2022-04-04,10-2022-0041802,2024-03-15,10-2649630,공경철,"공경철,이수민,조현태,윤용탁,공경철",케이블 견인 구동장치 및 이를 포함하는 착용형 슈트,나노기술(NT),2024-12-31
408,2022-06-29,10-2022-0079445,2024-06-11,10-2675511,김용희,김용희,다층구조 핵연료 피복관 제조 방법 및 다층구조 핵연료 피복관 제조 장치,나노기술(NT),2024-12-31
409,2022-10-24,10-2022-0137732,2024-12-12,10-2743930,김지환,"김지환,서준호",조셉슨 효과를 이용한 마이크로파 대역의 표면파 생성 소자 및 방법,나노기술(NT),2024-12-31
410,2022-06-20,10-2022-0075186,2024-03-06,10-2646338,윤세영,"윤세영,배상민,오재훈,김상묵,신재우,김성윤,정우진",향상된 표상을 위한 연합학습 알고리즘,정보기술(IT),2024-12-31
411,2022-10-19,10-2022-0135059,2024-01-24,10-2630328,이현주,"이현주,이태민,이상목",습도센서 모듈과 이를 구비하는 습도 측정장치 및 이를 이용하는 습도측정 방법 ,정보기술(IT),2024-12-31
412,2022-09-16,10-2022-0117007,2024-06-12,10-2675904,한동수,"한동수,이윤헌,김창준,최보현,이기훈,이준구,이증락",저궤도 위성 네트워크 구성 방법 및 장치,정보기술(IT),2024-12-31
413,2022-11-09,10-2022-0148883,2024-01-24,10-2630332,이현주,"이현주,김미경,Jia Chee Leong,김기업",생체탐침 모듈과 이를 구비하는 생체정보 검출장치 및 생체탐침모듈의제조방법,정보기술(IT),2024-12-31
414,2022-07-20,10-2022-0089863,2024-09-30,10-2713966,김규태,"김규태,이태송","인젝터, 이를 포함하는 연소기 및 이를 포함하는 가스 터빈",환경/에너지기술(ET),2024-12-31
415,2022-08-17,10-2022-0102960,2024-04-02,10-2655393,신진우,"신진우,김서진,정종헌",적대적 강인성을 위한 신경망모델의 학습방법 및 이를 위한 장치,정보기술(IT),2024-12-31
416,2022-10-14,10-2022-0132563,2024-02-15,10-2638369,노준용,"노준용,김혜민,조경민",모션 클립의 보정 방법 및 장치,문화기술(CT),2024-12-31
417,2022-12-14,10-2022-0174790,2024-12-18,10-2746022,이행기,"이행기,김나루,박지훈,장대익",균열자가진단 및 자가치유가 가능한 콘크리트 구조물 및 콘크리트 구조물의 모니터링 시스템,정보기술(IT),2024-12-31
418,2022-08-31,10-2022-0109670,2024-12-12,10-2743711,유홍기,"유홍기,이동령",원격 초점 조절과 공초점을 이용한 구강 내 치아 스캐너 및 이에 의한 스캐닝 방법,정보기술(IT),2024-12-31
419,2023-03-24,10-2023-0038738,2024-01-10,10-2625027,이현주,"이현주,국건",공간 초음파 변조기 및 이를 구비하는 초음파 장치와 이를 이용한 진폭변조 초음파의 생성방법 ,생명공학기술(BT),2024-12-31
420,2022-08-03,10-2022-0096725,2024-08-06,10-2693987,이재우,"이재우,양정우,김호동",이산화탄소가 함유된 가스로부터의 계층적 탄소소재에 단일 금속원자 촉매 및 질소 원자가 포함된 다공성 복합체를 제조하는 방법,환경/에너지기술(ET),2024-12-31
421,2022-10-14,10-2022-0132382,2024-11-12,10-2731174,윤준보,"윤준보,김태수,이용복,이소영,이승준",기계식 비휘발성 메모리 장치 및 기계식 메모리,나노기술(NT),2024-12-31
422,2022-12-12,10-2022-0172961,2024-11-12,10-2730654,안승영,"안승영,최세민,허성렬,김해림,우성호",이중모드 멀티코일 무선전력전송 시스템 ,정보기술(IT),2024-12-31
423,2021-07-22,10-2021-0096446,2024-02-07,10-2636472,최학준,"최학준,조동호,정구호,홍순만",고정형/이동형 무선 급전패드와 차량의 임의의 공간에 장착이 가능한 무선 집전패드와 레귤레이터,정보기술(IT),2024-12-31
424,2022-08-31,10-2022-0110216,2024-12-26,10-2748563,김택수,"김택수,김지훈,표재범",원격 제어가 가능한 반자기 부상 로터 및 이를 이용한 소프트 액츄에이터,정보기술(IT),2024-12-31
425,2022-11-11,10-2022-0150920,2024-11-06,10-2728719,한승민,"한승민,최시은",벌크 금속 다층 구조체의 제조 방법,나노기술(NT),2024-12-31
426,2022-11-04,10-2022-0145966,2024-07-29,10-2690596,강준혁,"강준혁,유성훈",심층 강화 학습 기반의 보안 오프로딩 방법 및 상기 방법을 수행하는 무인 항공기,정보기술(IT),2024-12-31
427,2023-01-30,10-2023-0011750,2024-02-06,10-2635646,조계춘,"조계춘,이민형",가교 바이오폴리머를 포함하는 지반 강화용 토양 조성물 및 이를 이용한 지반 강화용 시공방법,환경/에너지기술(ET),2024-12-31
428,2022-10-17,10-2022-0132964,2024-06-28,10-2680819,김용대,"김용대,장준하,조만기,김동관,김재훈",센서 제어 유닛 간 통신 왜곡을 통한 안티드론 시스템 및 그 동작 방법,정보기술(IT),2024-12-31
429,2022-10-19,10-2022-0134846,2024-10-22,10-2722171,염지현,염지현,전자 및 양성자가 동시 도핑된 셀레늄 나노와이어 및 이의 제조방법,나노기술(NT),2024-12-31
430,2022-10-20,10-2022-0135864,2024-12-03,10-2739864,김산하,"김산하,김동근,Filippo Danilo Michelacci",3D 프린터 지지패드 및 이를 구비한 3D 프린팅 시스템,정보기술(IT),2024-12-31
431,2022-10-18,10-2022-0134395,2024-07-01,10-2681675,박상후,"박상후,김현주,한나래,김미향,이진영,이유영,강문석",플라즈마 처리를 포함하는 땅콩 겉껍질의 기능성 개선 방법,정보기술(IT),2024-12-31
432,2022-10-27,10-2022-0140468,2024-06-21,10-2678612,강준혁,"강준혁,김상혁,차서현",송신안테나 모델링 방법 및 이를 위한 모델링 장치,문화기술(CT),2024-12-31
433,2022-10-21,10-2022-0136660,2024-08-14,10-2696685,김종환,"김종환,홍찬솔,이경민",경기장 바닥면의 마찰계수 가변 제어를 이용한 인공지능 로봇축구 시뮬레이션 경기 제어 방법 ,정보기술(IT),2024-12-31
434,2022-09-15,10-2022-0116511,2024-04-22,10-2660894,장석복,"장석복,함원석,최훈철,지엔뽀장",피리미딘-2-아민 화합물의 제조방법,나노기술(NT),2024-12-31
435,2022-12-21,10-2022-0180237,2024-11-25,10-2735566,최준일,"최준일,차지훈,김환진",와이파이 채널 상태 정보를 활용한 심층 신경망 기반의 실내 적응형 사람 인지 방법 및 시스템,정보기술(IT),2024-12-31
436,2022-11-02,10-2022-0144369,2024-09-24,10-2711338,공경철,"공경철,고찬영,최상욱,윤용탁,공경철",착용형 로봇의 제어방법,나노기술(NT),2024-12-31
437,2022-12-14,10-2022-0174609,2024-05-23,10-2670139,김성민,"김성민,심승우,신현호","저해상도 이미징 장치, 동작 인식 방법, 동작 인식 장치 및 동작 인식 시스템",정보기술(IT),2024-12-31
438,2023-01-03,10-2023-0000493,2024-11-07,10-2728900,김대식,"김대식,이재혁",주의 알고리즘 기반의 단일/다중 소스 이미지를 활용 가능한 고선명도 얼굴 교체 시스템 및 방법,정보기술(IT),2024-12-31
439,2022-12-21,10-2022-0181081,2024-11-15,10-2732226,한동수,"한동수,예준철,여현호",이미지 압축 및 뉴럴넷 기반 초해상화 공동 최적화 방법 및 장치,정보기술(IT),2024-12-31
440,2023-02-09,10-2023-0017315,2024-01-09,10-2624551,김민준,"김민준,정진영",회전 변위의 제약이 없는 다관절 로봇의 작업공간 유연제어 방법,정보기술(IT),2024-12-31
441,2022-12-28,10-2022-0186814,2024-07-18,10-2687398,박형순,"박형순,권혁준,박찬범",재활 운동 모니터링 시스템 및 그 모니터링 방법,생명공학기술(BT),2024-12-31
442,2022-12-19,10-2022-0178678,2024-07-19,10-2688049,김성민,"김성민,심승우,신현호","저해상도 이미징 장치, 동작 인식 방법, 동작 인식 장치 및 동작 인식 시스템",정보기술(IT),2024-12-31
443,2022-12-20,10-2022-0179530,2024-04-24,10-2661899,하동수,"하동수,Nengroo, Sarvar Hussain,진호준,이상금",신재생에너지 발전량 예측 장치 및 방법,정보기술(IT),2024-12-31
444,2023-02-09,10-2023-0017517,2024-12-24,10-2748118,오왕열,"오왕열,김경환,박현상",혈관 내에 흐르는 혈구의 직접적 이미징 방법,기타(EC),2024-12-31
445,2023-03-24,10-2023-0038496,2024-12-04,10-2740239,김주영,"김주영,김정훈,유성엽",다중 신경망 가속을 위한 확장가능 벡터-어레이 이종 가속 기 구조 및 스케쥴링 기법,정보기술(IT),2024-12-31
446,2023-01-26,10-2023-0010102,2024-05-13,10-2666630,김상현,"김상현,박주혁,금대명",저전류 영역에서의 효율 증대 마이크로 발광 다이오드 소자와 그의 제조 방법 및 그를 포함하는 디스플레이,정보기술(IT),2024-12-31
447,2023-05-16,10-2023-0063427,2024-11-15,10-2732200,조성환,"조성환,이기우,김동환",메모리 디바이스,나노기술(NT),2024-12-31
448,2023-06-09,10-2023-0074044,2024-07-31,10-2691606,조성환,"조성환,이기우,김동환",메모리 디바이스,나노기술(NT),2024-12-31
449,2023-04-03,10-2023-0043659,2024-01-10,10-2624969,김윤기,"김윤기,신민경",mRNA 번역 증가를 유도하는 mRNA 3'UTR 서열,생명공학기술(BT),2024-12-31
450,2022-12-27,10-2022-0186443,2024-02-26,10-2642059,김문철,"김문철,기세환",다양한 영상 신호 특성의 다중 모델을 이용한 영상 화질 향상 방법 및 장치,정보기술(IT),2024-12-31
451,2023-06-05,10-2023-0072140,2024-12-02,10-2738696,장대준,"장대준,김세훈,편혜미",액체 수위측정장치 및 방법,환경/에너지기술(ET),2024-12-31
452,2023-04-21,10-2023-0052937,2024-11-06,10-2728698,우운택,"우운택,김두영",원격 협업용 공유 공간 생성 방법 및 시스템,정보기술(IT),2024-12-31
453,2023-06-05,10-2023-0072136,2024-12-02,10-2738703,장대준,"장대준,김세훈,편혜미",액체 수위측정장치 및 방법,환경/에너지기술(ET),2024-12-31
454,2023-05-19,10-2023-0064892,2024-07-26,10-2690492,최인성,"최인성,한상영,윤경원",폴리페놀계 화합물 및 3가 철염을 포함하는 초분자 졸을 함유하는 항균 및 항바이러스용 코팅 필름,생명공학기술(BT),2024-12-31
455,2023-04-19,10-2023-0051620,2024-12-05,10-2741087,김주영,"김주영,조현준,한원탁,김동혁",룩-업 테이블 기반 선형 보간을 이용하는 서브어레이-레벨 프로세싱-인-메모리 구조,정보기술(IT),2024-12-31
456,2023-04-19,10-2023-0051619,2024-09-24,10-2710971,김주영,"김주영,김재영,이석진,양제,임석빈",예측기반 양자화와 삼중 이기종 구조를 가진 다중 심층신경망 학습 프로세서,정보기술(IT),2024-12-31
457,2023-04-03,10-2023-0043291,2024-10-31,10-2725945,남윤성,"남윤성,구본일,RAFIA TASNIM RAHMAN",우수한 분산 안정성을 갖는 멀티라멜라 콜라겐-지질 소포 및 그 제조방법,생명공학기술(BT),2024-12-31
458,2023-05-12,10-2023-0061695,2024-12-09,10-2742159,김성수,"김성수,박성연,온승윤",전자 패키지 몰딩 장치와 몰딩 방법 및 이를 이용하여 제작된 전자 패키지,기타(EC),2024-12-31
459,2023-07-04,10-2023-0086433,2024-07-26,10-2690517,강준혁,"강준혁,이영준,박상우,공진우",가변 학습율을 이용한 연합학습방법 및 장치,정보기술(IT),2024-12-31
460,2023-04-27,10-2023-0055368,2024-04-16,10-2659172,홍승훈,"홍승훈,오세윤,김진우,조성준",그래프 및 하이퍼그래프 처리를 위한 등변적 하이퍼그래프 신경망을 갖는 컴퓨터 장치 및 그의 방법,정보기술(IT),2024-12-31
461,2023-06-09,10-2023-0074048,2024-12-12,10-2743561,조성환,"조성환,이기우,김동환",메모리 디바이스,나노기술(NT),2024-12-31
462,2023-05-04,10-2023-0058355,2024-07-29,10-2690863,이상엽,"이상엽,장우대",코로나바이러스감염증-19 예방 또는 치료용 약학적 조성물,생명공학기술(BT),2024-12-31
463,2023-06-26,10-2023-0081660,2024-01-16,10-2627070,이흥규,"이흥규,김재호","미생물, 및 면역관문 억제제를 유효성분으로 포함하는, 고 당분 환경에서의 뇌종양 예방 또는 치료용 조성물",생명공학기술(BT),2024-12-31
464,2023-06-26,10-2023-0082121,2024-10-16,10-2719910,김주영,"김주영,김재영,이석진,유승재,조현준,윤성웅,김동혁",비정형 희소성을 위한 멀티칩 모듈 CIM 기반의 전치 매크로를 갖는 하이브리드 희소-밀집 CIM 트랜스포머 가속기,정보기술(IT),2024-12-31
465,2023-06-26,10-2023-0082122,2024-05-29,10-2671555,김주영,"김주영,김재영,이석진,유승재,조현준,윤성웅,김동혁",재구성 가능한 RBL과 RWL 드라이버를 갖는 전력 효율적인 이중 모드 2T-임베디드 DRAM CIM 매크로,정보기술(IT),2024-12-31
466,2023-06-14,10-2023-0076310,2024-07-24,10-2689248,김주영,"김주영,임석빈,허재훈,양진호",가상 복셀과 관심 영역 기반 스킵핑을 활용한 대규모 포인트 클라우드 신경망 가속 프로세서,정보기술(IT),2024-12-31
467,2023-06-15,10-2023-0076657,2024-04-22,10-2661017,정재웅,"정재웅,카렌,정원일,양경모","체온에 의해 부드럽게 변하고 재사용이 불가능하며 온도 센싱 기능을 가진 가변강성 정맥 주사바늘, 그를 갖는 정맥 주사세트, 및 그의 제조 방법",생명공학기술(BT),2024-12-31
468,2023-07-13,10-2023-0091258,2024-07-22,10-2688596,이대영,"이대영,이성빈,조남석,이태영","스파이럴 루프 지름 가변형 휠, 그의 제작 방법, 및 그를 갖는 무인 차량",우주항공기술(ST),2024-12-31
